{
  "model_fingerprint": "sha256:f61ff5cf8e1cc88da6944d6bcd3e2e7da5ff27dd3288a8781908018cb8240cd6",
  "operations": [
    {
      "appearance_intent": null,
      "attribute_intents": [],
      "occurrence_reuse_intent": null,
      "operation_id": "window-1-add-with-opening",
      "operation_type": "add_window_with_opening_to_wall",
      "parameters": {
        "opening": {
          "height_mm": 500,
          "sill_height_mm": 2670.828,
          "width_mm": 1180
        },
        "position": {
          "center_offset_mm": 4701.961,
          "reference": "wall_local_start"
        },
        "window": {
          "fit_opening": true
        }
      },
      "property_intents": [],
      "prototype_intent": null,
      "provenance": [
        {
          "excerpt": "1. 窗 1：不得使用已删除 Window 的 GlobalId 或 Name 定位。请在楼层标高 -2213.701 mm、朝南、长 17765.292 mm、高 3581.701 mm、厚 240 mm 的直墙上，以 wall_local_start 为基准，在中心偏移 4701.961 mm 处新建一个 Opening，并安装一扇宽 1180 mm、高 500 mm、窗台高 2670.828 mm 的 Window；Window 必须 fit opening。未指定复用现有 WindowType，使用该操作支持的受控模板。",
          "reference": "request:/text",
          "source_kind": "user_request"
        }
      ],
      "quantity_intents": [],
      "routing_intent": {
        "action": "add_with_opening",
        "component_family": "window",
        "operation_profile": "window.add-with-opening",
        "source": {
          "excerpt": "1. 窗 1：不得使用已删除 Window 的 GlobalId 或 Name 定位。请在楼层标高 -2213.701 mm、朝南、长 17765.292 mm、高 3581.701 mm、厚 240 mm 的直墙上，以 wall_local_start 为基准，在中心偏移 4701.961 mm 处新建一个 Opening，并安装一扇宽 1180 mm、高 500 mm、窗台高 2670.828 mm 的 Window；Window 必须 fit opening。未指定复用现有 WindowType，使用该操作支持的受控模板。",
          "reference": "request:/text",
          "source_kind": "user_request"
        }
      },
      "semantic_bundle_refs": [],
      "target_query": {
        "allowed_ifc_classes": [
          "IfcWall"
        ],
        "direction": "south",
        "geometry_constraints": [
          {
            "field": "storey_elevation_mm",
            "value": -2213.701
          },
          {
            "field": "wall_length_mm",
            "value": 17765.292
          },
          {
            "field": "wall_height_mm",
            "value": 3581.701
          },
          {
            "field": "wall_thickness_mm",
            "value": 240
          }
        ],
        "schema_version": "text2ifc/ifc-target-query/0.1"
      }
    },
    {
      "appearance_intent": null,
      "attribute_intents": [],
      "occurrence_reuse_intent": null,
      "operation_id": "window-2-add-with-opening",
      "operation_type": "add_window_with_opening_to_wall",
      "parameters": {
        "opening": {
          "height_mm": 2370,
          "sill_height_mm": 610,
          "width_mm": 870
        },
        "position": {
          "center_offset_mm": 9315.561,
          "reference": "wall_local_start"
        },
        "window": {
          "fit_opening": true
        }
      },
      "property_intents": [],
      "prototype_intent": null,
      "provenance": [
        {
          "excerpt": "2. 窗 2：不得使用已删除 Window 的 GlobalId 或 Name 定位。请在楼层标高 -2213.701 mm、朝东、长 13455.561 mm、高 4175.094 mm、厚 240 mm 的直墙上，以 wall_local_start 为基准，在中心偏移 9315.561 mm 处新建一个 Opening，并安装一扇宽 870 mm、高 2370 mm、窗台高 610 mm 的 Window；Window 必须 fit opening。未指定复用现有 WindowType，使用该操作支持的受控模板。",
          "reference": "request:/text",
          "source_kind": "user_request"
        }
      ],
      "quantity_intents": [],
      "routing_intent": {
        "action": "add_with_opening",
        "component_family": "window",
        "operation_profile": "window.add-with-opening",
        "source": {
          "excerpt": "2. 窗 2：不得使用已删除 Window 的 GlobalId 或 Name 定位。请在楼层标高 -2213.701 mm、朝东、长 13455.561 mm、高 4175.094 mm、厚 240 mm 的直墙上，以 wall_local_start 为基准，在中心偏移 9315.561 mm 处新建一个 Opening，并安装一扇宽 870 mm、高 2370 mm、窗台高 610 mm 的 Window；Window 必须 fit opening。未指定复用现有 WindowType，使用该操作支持的受控模板。",
          "reference": "request:/text",
          "source_kind": "user_request"
        }
      },
      "semantic_bundle_refs": [],
      "target_query": {
        "allowed_ifc_classes": [
          "IfcWall"
        ],
        "direction": "east",
        "geometry_constraints": [
          {
            "field": "storey_elevation_mm",
            "value": -2213.701
          },
          {
            "field": "wall_length_mm",
            "value": 13455.561
          },
          {
            "field": "wall_height_mm",
            "value": 4175.094
          },
          {
            "field": "wall_thickness_mm",
            "value": 240
          }
        ],
        "schema_version": "text2ifc/ifc-target-query/0.1"
      }
    },
    {
      "appearance_intent": null,
      "attribute_intents": [],
      "occurrence_reuse_intent": null,
      "operation_id": "door-1-fill-existing-opening",
      "operation_type": "fill_existing_opening_with_door",
      "parameters": {
        "door": {
          "formal_enum_explicit": true,
          "operation_type": "SINGLE_SWING_LEFT"
        },
        "fit_existing_opening": true
      },
      "property_intents": [],
      "prototype_intent": null,
      "provenance": [
        {
          "excerpt": "3. 门 1：不得使用已删除 Door 的 GlobalId 或 Name 定位。请找到当前 IFC 中尚未填充、宽 800 mm、高 2480 mm、洞深 160 mm、墙局部中心偏移 565.932 mm、门槛高 130.359 mm 的既有 Opening，在这个既有 Opening 中安装一扇宽 800 mm、高 2480 mm、operation type 为 SINGLE_SWING_LEFT 的 Door；必须复用该既有 Opening，不得新建第二个 Opening。未指定复用现有 DoorType，使用该操作支持的受控模板。",
          "reference": "request:/text",
          "source_kind": "user_request"
        }
      ],
      "quantity_intents": [],
      "routing_intent": {
        "action": "fill_existing_opening",
        "component_family": "door",
        "operation_profile": "door.fill-existing-opening.v0.2",
        "source": {
          "excerpt": "3. 门 1：不得使用已删除 Door 的 GlobalId 或 Name 定位。请找到当前 IFC 中尚未填充、宽 800 mm、高 2480 mm、洞深 160 mm、墙局部中心偏移 565.932 mm、门槛高 130.359 mm 的既有 Opening，在这个既有 Opening 中安装一扇宽 800 mm、高 2480 mm、operation type 为 SINGLE_SWING_LEFT 的 Door；必须复用该既有 Opening，不得新建第二个 Opening。未指定复用现有 DoorType，使用该操作支持的受控模板。",
          "reference": "request:/text",
          "source_kind": "user_request"
        }
      },
      "semantic_bundle_refs": [],
      "target_query": {
        "allowed_ifc_classes": [
          "IfcOpeningElement"
        ],
        "geometry_constraints": [
          {
            "field": "opening_width_mm",
            "value": 800
          },
          {
            "field": "opening_height_mm",
            "value": 2480
          },
          {
            "field": "opening_depth_mm",
            "value": 160
          },
          {
            "field": "opening_center_offset_mm",
            "value": 565.932
          },
          {
            "field": "opening_sill_height_mm",
            "value": 130.359
          }
        ],
        "schema_version": "text2ifc/ifc-target-query/0.1"
      }
    },
    {
      "appearance_intent": null,
      "attribute_intents": [],
      "occurrence_reuse_intent": null,
      "operation_id": "door-2-fill-existing-opening",
      "operation_type": "fill_existing_opening_with_door",
      "parameters": {
        "door": {
          "formal_enum_explicit": true,
          "operation_type": "SINGLE_SWING_RIGHT"
        },
        "fit_existing_opening": true
      },
      "property_intents": [],
      "prototype_intent": null,
      "provenance": [
        {
          "excerpt": "4. 门 2：不得使用已删除 Door 的 GlobalId 或 Name 定位。请找到当前 IFC 中尚未填充、宽 935 mm、高 2400 mm、洞深 270 mm、墙局部中心偏移 6507.500 mm、门槛高 110.359 mm 的既有 Opening，在这个既有 Opening 中安装一扇宽 935 mm、高 2400 mm、operation type 为 SINGLE_SWING_RIGHT 的 Door；必须复用该既有 Opening，不得新建第二个 Opening。未指定复用现有 DoorType，使用该操作支持的受控模板。",
          "reference": "request:/text",
          "source_kind": "user_request"
        }
      ],
      "quantity_intents": [],
      "routing_intent": {
        "action": "fill_existing_opening",
        "component_family": "door",
        "operation_profile": "door.fill-existing-opening.v0.2",
        "source": {
          "excerpt": "4. 门 2：不得使用已删除 Door 的 GlobalId 或 Name 定位。请找到当前 IFC 中尚未填充、宽 935 mm、高 2400 mm、洞深 270 mm、墙局部中心偏移 6507.500 mm、门槛高 110.359 mm 的既有 Opening，在这个既有 Opening 中安装一扇宽 935 mm、高 2400 mm、operation type 为 SINGLE_SWING_RIGHT 的 Door；必须复用该既有 Opening，不得新建第二个 Opening。未指定复用现有 DoorType，使用该操作支持的受控模板。",
          "reference": "request:/text",
          "source_kind": "user_request"
        }
      },
      "semantic_bundle_refs": [],
      "target_query": {
        "allowed_ifc_classes": [
          "IfcOpeningElement"
        ],
        "geometry_constraints": [
          {
            "field": "opening_width_mm",
            "value": 935
          },
          {
            "field": "opening_height_mm",
            "value": 2400
          },
          {
            "field": "opening_depth_mm",
            "value": 270
          },
          {
            "field": "opening_center_offset_mm",
            "value": 6507.5
          },
          {
            "field": "opening_sill_height_mm",
            "value": 110.359
          }
        ],
        "schema_version": "text2ifc/ifc-target-query/0.1"
      }
    },
    {
      "appearance_intent": null,
      "attribute_intents": [
        {
          "intent_kind": "material",
          "name": "Material",
          "source": {
            "excerpt": "5. 梁：在标高7恢复一根缺失的水平直线矩形 Beam。Storey-local 中心轴从 (-3316.629521, -3863.522838, -285) mm 到 (-3316.629521, -8803.522838, -285) mm，截面宽 455 mm、高 570 mm。精确复用 GlobalId 为 17tPjyQtf2L9JnbXXmcTTd、名称为 S_支撑梁-1-ZC1 700x800 C30 的现有 IfcBeamType；同时精确复用现有 IfcMaterial C_钢筋砼C30 作为这根恢复梁的 occurrence-level Material。本 mixed request 没有指定新的表面颜色，不得把前一个 focused case 的红色 appearance 带到本次梁上。",
            "reference": "request:/text",
            "source_kind": "user_request"
          },
          "value": "C_钢筋砼C30"
        }
      ],
      "occurrence_reuse_intent": null,
      "operation_id": "beam-restore-level-7",
      "operation_type": "add_beam",